{
  "schemaVersion": 1,
  "transactionId": "550e8400-e29b-41d4-a716-446655440000",
  "generation": 3,
  "podUid": "b3e6d1f0-1a2b-4c5d-9e8f-001122334455",
  "observedPhase": "MAINTENANCE_ACTIVE",
  "jarChecksumsBefore": {
    "lepinoidTools": "cccccccccccccccccccccccccccccccccccccccccccccccccccccccccccccccc",
    "multiverseCore": "dddddddddddddddddddddddddddddddddddddddddddddddddddddddddddddddd"
  },
  "jarChecksumsAfter": {
    "lepinoidTools": "b20e389706bafd0778807650b83043a070362781d51c7ff800ceba61a61a8340",
    "multiverseCore": "90a39133f36240b28739b7c100492371702f8ad1d7f7621b028f8d2af49fe1c3"
  },
  "persistedWhitelistBefore": true,
  "persistedWhitelistAfter": true,
  "flagBefore": true,
  "flagAfter": true,
  "fencingGenerationBefore": 3,
  "fencingGenerationAfter": 3,
  "result": "repaired",
  "consumedByJobUid": "f47ac10b-58cc-4372-a567-0e02b2c3d479",
  "timestamp": "2026-09-07T00:00:00Z"
}
